{"jsonrpc":"2.0","id":"run-1","method":"start","params":{"session_id":"operation-1","attempt_id":"attempt-1","payload":{"contract":{"major":1,"minor":0},"operation_id":"operation-1","attempt_id":"attempt-1","pin":{"source_commit":"d577c5249501b29e33a87524a677a101477d5579","source_tree":"97d08b39026f7c7d3e6f748b26a20e819a92184f","executable_sha256":"e1228516fe0648db35cfb7b6669b09f25dc32f62691c8fc8cca4ee1e935eee88"},"mode":"external_application","arguments":["--scenario","baseline","--iterations","1","--units","1","--command","/usr/bin/true"],"environment":{"TZ":"UTC"},"artifacts":[]}}}
